{
  "id": "OP02-068",
  "set": "OP02",
  "number": 68,
  "name": "Gum Gum Rain",
  "category": "Event",
  "colors": ["Blue"],
  "attribute": null,
  "types": ["Impel Down", "Straw Hat Pirates"],
  "rarity": "R",
  "art": "/cards/OP02/OP02-068.png",
  "stats": {
    "cost": 0,
    "power": null,
    "life": null,
    "counter": { "present": false, "value": 0 }
  },
  "keywords": ["Counter", "Trigger"],
  "trigger": { "text": "Return up to 1 Character with a cost of 2 or less to the owner's hand." },
  "text": "Counter: You may trash 1 card from your hand: Your Leader or up to 1 of your Characters gains +3000 Power during this battle.",
  "abilities": [],
  "meta": { "notes": null }
}