{
  "id": "OP14-042",
  "set": "OP14",
  "number": 42,
  "name": "Arlong",
  "category": "Character",
  "colors": [
    "Blue"
  ],
  "attribute": "Slash",
  "types": [
    "Fish-Man",
    "The Sun Pirates"
  ],
  "rarity": "R",
  "art": "/cards/OP14/OP14-042.png",
  "stats": {
    "cost": 1,
    "power": 3000,
    "life": null,
    "counter": {
      "present": false,
      "value": 0
    }
  },
  "keywords": [
    "On Play"
  ],
  "trigger": null,
  "text": "On Play: If your Leader has the {Fish-Man} type, look at 4 cards from the top of your deck; reveal up to 1 card with a cost of 2 or more and add it to your hand. Then, place the rest at the bottom of your deck in any order.",
  "abilities": [
    {
      "timing": "On Play",
      "frequency": null,
      "donReq": null,
      "cost": {
        "restDonFromCostArea": 0
      },
      "effect": {
        "text": "If your Leader has the {Fish-Man} type, look at 4 cards from the top of your deck; reveal up to 1 card with a cost of 2 or more and add it to your hand. Then, place the rest at the bottom of your deck in any order.",
        "powerMod": null,
        "conditions": [
          "yourLeader",
          "hasType:Fish-Man"
        ],
        "giveDon": null
      }
    }
  ],
  "meta": {
    "notes": null
  }
}
