{
  "id": "OP08-101",
  "set": "OP08",
  "number": 101,
  "name": "Charlotte Angel",
  "category": "Character",
  "colors": [
    "Red"
  ],
  "attribute": "Slash",
  "types": [
    "Big Mom Pirates"
  ],
  "rarity": "C",
  "art": "/cards/OP08/OP08-101.png",
  "stats": {
    "cost": 2,
    "power": 3000,
    "life": null,
    "counter": {
      "present": true,
      "value": 1000
    }
  },
  "keywords": [
    "Activate: Main",
    "Once Per Turn"
  ],
  "trigger": null,
  "text": "Activate: Main Once Per Turn You may trash 1 card from the top of your Life cards: If your Leader has the (Big Mom Pirates) type, add up to 1 card from the top of your deck to the top of your Life cards at the end of this turn.",
  "abilities": [
    {
      "timing": "Activate: Main",
      "frequency": "Once Per Turn",
      "donReq": null,
      "cost": {
        "restDonFromCostArea": 0
      },
      "effect": {
        "text": "You may trash 1 card from the top of your Life cards: If your Leader has the (Big Mom Pirates) type, add up to 1 card from the top of your deck to the top of your Life cards at the end of this turn.",
        "powerMod": null,
        "conditions": [
          "your Leader has the (Big Mom Pirates) type"
        ],
        "giveDon": null
      }
    }
  ],
  "meta": {
    "notes": "Card is a sample; no additional notes needed."
  }
}
