{
  "id": "OP02-073",
  "set": "OP02",
  "number": 73,
  "name": "Sadi",
  "category": "Character",
  "colors": ["Purple"],
  "attribute": "Wisdom",
  "types": ["Impel Down"],
  "rarity": "UC",
  "art": "/cards/OP02/OP02-073.png",
  "stats": {
    "cost": 3,
    "power": 3000,
    "life": null,
    "counter": { "present": true, "value": 2000 }
  },
  "keywords": ["On Play"],
  "trigger": null,
  "text": "[On Play] Play up to 1 {Jailer Beast} type Character card from your hand.",
  "abilities": [
    {
      "timing": "On Play",
      "frequency": null,
      "donReq": null,
      "cost": { "restDonFromCostArea": 0 },
      "effect": {
        "text": "Play up to 1 {Jailer Beast} type Character card from your hand.",
        "targets": ["upTo1:hand:Character"],
        "conditions": ["typeJailerBeast"]
      }
    }
  ],
  "meta": { "notes": null }
}
