{
  "id": "OP08-062",
  "set": "OP08",
  "number": 62,
  "name": "Charlotte Katakuri",
  "category": "Character",
  "colors": [
    "Red"
  ],
  "attribute": "Strike",
  "types": [
    "Big Mom Pirates"
  ],
  "rarity": "UC",
  "art": "/cards/OP08/OP08-062.png",
  "stats": {
    "cost": 2,
    "power": 3000,
    "life": null,
    "counter": {
      "present": true,
      "value": 1000
    }
  },
  "keywords": [
    "Activate: Main"
  ],
  "trigger": null,
  "text": "Activate: Main You may trash this character: If your leader has the (Big Mom Pirates) type, play up to one [Charlotte Katakuri] from your hand that has a cost of 3 or greater and a cost less than or equal to the number of Don!! your opponent has.",
  "abilities": [
    {
      "timing": "Activate: Main",
      "frequency": null,
      "donReq": null,
      "cost": {
        "restDonFromCostArea": 0
      },
      "effect": {
        "text": "You may trash this character: If your leader has the (Big Mom Pirates) type, play up to one [Charlotte Katakuri] from your hand that has a cost of 3 or greater and a cost less than or equal to the number of Don!! your opponent has.",
        "powerMod": null,
        "conditions": [
          "your leader has the (Big Mom Pirates) type",
          "one [Charlotte Katakuri] from your hand that has a cost of 3 or greater",
          "cost less than or equal to the number of Don!! your opponent has"
        ],
        "giveDon": null
      }
    }
  ],
  "meta": {
    "notes": null
  }
}
