{
  "id": "OP11-048",
  "set": "OP11",
  "number": 48,
  "name": "Capone\"Gang\"Bege",
  "category": "Character",
  "colors": [
    "Blue"
  ],
  "attribute": "Ranged",
  "types": [
    "Supernovas",
    "Firetank Pirates"
  ],
  "rarity": "R",
  "art": "/cards/OP11/OP11-048.png",
  "stats": {
    "cost": 1,
    "power": 2000,
    "life": null,
    "counter": {
      "present": true,
      "value": 1000
    }
  },
  "keywords": [
    "On Play"
  ],
  "trigger": null,
  "text": "On Play: Look at 4 cards from the top of your deck; reveal up to 1 (Firetank Pirates) or (Straw Hat Crew) type card with a cost of 2 or more and add it to your hand. Then, place the rest at the bottom of your deck in any order.",
  "abilities": [
    {
      "timing": "On Play",
      "frequency": null,
      "donReq": null,
      "cost": {
        "restDonFromCostArea": 0
      },
      "effect": {
        "text": "Look at 4 cards from the top of your deck; reveal up to 1 (Firetank Pirates) or (Straw Hat Crew) type card with a cost of 2 or more and add it to your hand. Then, place the rest at the bottom of your deck in any order.",
        "powerMod": null,
        "giveDon": null
      }
    }
  ],
  "meta": {
    "notes": null
  }
}
