{
  "id": "OP05-109",
  "set": "OP05",
  "number": 109,
  "name": "Pagaya",
  "category": "Character",
  "colors": [
    "Yellow"
  ],
  "attribute": "Wisdom",
  "types": [
    "Sky Island"
  ],
  "rarity": "R",
  "art": "/cards/OP05/OP05-109.png",
  "stats": {
    "cost": 1,
    "power": 1000,
    "life": null,
    "counter": {
      "present": true,
      "value": 1000
    }
  },
  "keywords": [
    "Once Per Turn",
    "When a Trigger activates"
  ],
  "trigger": null,
  "text": "Once Per Turn When a Trigger activates, draw 2 cards and trash 2 cards from your hand.",
  "abilities": [
    {
      "timing": "Once Per Turn",
      "frequency": "Once Per Turn",
      "donReq": null,
      "cost": {
        "restDonFromCostArea": 0
      },
      "effect": {
        "text": "When a Trigger activates, draw 2 cards and trash 2 cards from your hand.",
        "powerMod": null,
        "giveDon": null
      }
    }
  ],
  "meta": {
    "notes": "Card is a sample and does not represent an actual card from the One Piece TCG. The text 'SAMPLE' is overlaid on the image."
  }
}
