{
  "id": "OP13-089",
  "set": "OP13",
  "number": 89,
  "name": "Saint.Topman.Warcury",
  "category": "Character",
  "colors": [
    "Black"
  ],
  "attribute": "Special",
  "types": [
    "Five Elders",
    "Celestial Dragons"
  ],
  "rarity": "R",
  "art": "/cards/OP13/OP13-089.png",
  "stats": {
    "cost": 4,
    "power": 5000,
    "life": null,
    "counter": {
      "present": true,
      "value": 1000
    }
  },
  "keywords": [
    "Blocker",
    "On K.O."
  ],
  "trigger": null,
  "text": "If you have 7 or more cards in your trash, this Character cannot be removed from the field by your opponent's effects and gains Blocker. On K.O. Draw 1 card.",
  "abilities": [
    {
      "timing": "On Play",
      "frequency": null,
      "donReq": null,
      "cost": {
        "restDonFromCostArea": 0
      },
      "effect": {
        "text": "If you have 7 or more cards in your trash, this Character cannot be removed from the field by your opponent's effects and gains Blocker.",
        "grants": [
          "Blocker"
        ],
        "powerMod": null,
        "giveDon": null
      }
    },
    {
      "timing": "On K.O.",
      "frequency": null,
      "donReq": null,
      "cost": {
        "restDonFromCostArea": 0
      },
      "effect": {
        "text": "Draw 1 card.",
        "powerMod": null,
        "giveDon": null
      }
    }
  ],
  "meta": {
    "notes": null
  }
}
